{
  "id": "rev.a1b2c3",
  "entity_type": "review_schedule",
  "schema_version": "1.0.0",
  "learner_id": "user.demo",
  "target_ref": {
    "entity_type": "theorem",
    "id": "thm.nt.bezout-identity"
  },
  "algorithm": "sm2",
  "status": "due",
  "due_at": "2026-03-08T10:05:00Z",
  "interval_days": 3,
  "repetition_count": 2,
  "ease_factor": 2.5,
  "audit": {
    "created_at": "2026-03-08T10:00:00Z",
    "updated_at": "2026-03-08T10:05:00Z",
    "created_by": "system.seed",
    "updated_by": "system.seed"
  }
}
